1	https://segurosdemoto.mapfre.es	https://www.bing.com/th?id=OADD2.7902766197642_1UDWUNB97NH8P8O3R0&pid=21.2	good		Asistencia en todo tipo de vías	Incluyendo caminos y pistas​ Las mejores ventajas en tu Seguro de Moto Asistencia  en viaje Asistencia en viaje desde el km. 0 y en cualquier tipo de vía. Defensa de multas Conduce tranquilo con nuestro servicio de defensa ante multas. Reclamación de daños Te ofrecemos nuestro servicio de reclamación de daños. Facilidad de Pago Tus seguros en un solo recibo y elige el mejor día del mes para pagar tu cuota mensual Te damos orientación jurídico-administrativa en lo que necesites. Tu seguro de moto, al mejor precio Seguro de ciclomotor Seguro de responsabilidad civil obligatoria + suplementaria. Cobertura de daños por acontecimientos extraordinarios. Defensa jurídica Seguro de moto básico Seguro del conductor. Asistencia en viaje. Asistencia al motorista. Seguro de moto Terceros Ampliado Protección frente a incendios. Defensa de multas. Intereses y gastos del préstamo para la reparación del  vehículo. Hogar				MAPFRE ESPAÑA S.A. como responsable del tratamiento, utilizará sus datos personales para atender su petición a través de los canales que nos ha facilitado. Leer más. MAPFRE E	Contrata tu Seguro de moto con MAPFRE. Las mejores coberturas al mejor precio en tu seguro de motocicleta.	Área de cliente Inicio Ventajas Comparativa Otros productos Calcula  tu precio Te llamamos gratis Compensación por casco y vestimenta Más de 1.500 grúas propias Te llamamos  gratis Siempre contigo Elige los beneficios que más se ajustan a ti y contrata las coberturas que necesitas  para que tu moto siempre esté protegida. Terceros Todo Riesgo Calcula tu precio Mostrar coberturas Ahorra en tu seguro de Hogar con reparación de electrodomésticos Calcula tu precio Coche Tranquilidad y confianza al mejor precio en tu Seguro de Coche, con las mejores  coberturas Salud Personaliza al detalle la asistencia sanitaria que deseas con vídeo consultas  incluidas Ajustes de cookies MAPFRE ESPAÑA S.A. - Carretera de Pozuelo, 50, 28222 Majadahonda, Madrid Contrata tu Seguro de moto con MAPFRE. Las mejores coberturas al mejor precio en tu seguro de motocicleta.
11	https://luz.planos-iberdrola.pt/	https://www.bing.com/th?id=OADD2.1320513572842455_1M5SS1CGFJMGACD&pid=21.2	good	Descubra as melhores Tarifas e Ofertas Iberdrola | Iberdrola		Iberdrola: Energia Sustentável para a Sua Casa luz.planos-iberdrola Desconto até 20% para sempre + Oferta de 60€* Conheça as melhores tarifas da Iberdrola gás e eletricidade Tarifas de eletricidade e de gás Iberdrola que se adaptam ao seu consumo. Eletricidade Eletricidade e Gás Em menos de um minuto Simule a sua tarifa e encontre os melhores preços na Iberdrola Preencha esta informação e indicaremos automaticamente qual a tarifa mais adequada para si, sem qualquer compromisso! Poupe com as ofertas da Iberdrola que preparámos para si Mais estabilidade e poupança num plano de energia que se adapta a si e ao seu estilo de vida. Formatos suportados: .PNG .JPG .PDF Algumas das vantagens de celebrar um contrato com a Iberdrola Perguntas frequentes sobre a Iberdrola Luz e Gás Qual é o contacto da Iberdrola? Qual é o preço do kwh da Iberdrola? Que serviços adicionais posso contratar com a Iberdrola? Quanto custa mudar para a Iberdrola?	descubra as melhores tarifas e ofertas iberdrola iberdrola			Os preços da eletricidade da Iberdrola podem variar dependendo da tarifa que escolher, pois oferecem diferentes opções adaptadas às suas necessidades, como tarifas simples ou 	Compare as tarifas da Iberdrola e encontre a opção ideal. Faça o seu contrato Iberdrola online de forma rápida e fácil - comece a poupar hoje mesmo!	Tarifas Simule a sua tarifa Saber mais Simule a melhor tarifa! Luz Gás Luz e Gás Quando é o seu maior consumo? Telefone* Código postal Os seus dados serão tratados pela Iberdrola Clientes Portugal Unipessoal Lda., na qualidade de Responsável pelo Tratamento, para efeitos de envio e seguimento da simulação solicitada. Para mais informações acerca de como tratamos os seus dados e como poderá exercer os seus direitos, consulte a política de privacidade da Iberdrola clicando aqui Simule já! Até 20% desconto e oferta de 40€ Oferta de 40€ Sem fidelização. Eletricidade verde de fontes renováveis. Gás Oferta de 20 % desconto. 2% desconto extra se contratar o serviço Manutenção Gás. e oferta de 60€ Oferta de 60€ SIMULE SUA TARIFA Pague menos na sua fatura. Economize na sua conta em menos de um minuto. Eletricidade Gás Eletricidade + gás Desconto até 20% para sempre* Anexe sua fatura e receba uma proposta personalizada Anexe a sua fatura* Arrastar ou anexar sua fatura Comece já a poupar! Confiança 100 Milhões de consumidores em todo o mundo. 100% energia verde 1º produtor de energia eólica do mundo. App Iberdrola Controle o seu consumo e poupança em tempo real. Experiência +170 anos de História e hoje líder do setor energético global. Suporte técnico Atendemos 24h emergências ou reparações domésticas. O número de telefone da Iberdrola varia dependendo do tipo de consulta que deseja realizar, e oferecem várias opções de contatos gratuitos para facilitar a comunicação com seus clientes. Se estiver interessado em saber mais sobre alguma das promoções atuais da Iberdrola ou quiser contratar a Iberdrola, o contato gratuito é 210 302 265 Os preços da eletricidade da Iberdrola podem variar dependendo da tarifa que escolher, pois oferecem diferentes opções adaptadas às suas necessidades, como tarifas simples ou com discriminação horária (Bi-horária). Se pretende saber qual a tarifa que melhor se adapta aos seus hábitos de consumo de energia e às características da sua casa ou empresa, pode contactar os nossos consultores através do telefone gratuito 91 771 41 25. Teremos todo o gosto em ajudá-lo, sem qualquer compromisso! A adesão a serviços adicionais Iberdrola não só lhe proporciona uma gestão mais cómoda como também ainda mais poupanças na fatura mensal. Ao aderir à Fatura Eletrónica e/ou ao modo de pagamento Débito Direto em Conta, recebe 1% de desconto por cada um destes serviços. Se contratar o serviço Manutenção Gás, recebe 2% desconto extra. Isto é, na Iberdrola, com a contratação deste serviço adicional, não só beneficia da tranquilidade de uma resolução rápida e cómoda como ainda de 2 meses gratuitos e 2% de desconto sobre o preço das tarifas de gás. A mudança para a Iberdrola não só não tem quaisquer custos associados, como tratamos de todos os procedimentos e trâmites necessários. Consulte as nossas campanhas e preços: Eletricidade e Gás *Mais Poupança: Até 20% de desconto para sempre + Oferta de 40€ na Energia Verde e Oferta de 20€ no Gás. **Condições contrato de fornecimento de energia eléctrica. Saber mais Desfrute de um maior controlo sobre o seu orçamento familiar com um desconto de 16% com duração vitalícia. Usufrua ainda de um desconto adicional de 4% ao aderir à Fatura Eletrónica, Débito Direto e ao serviço de Proteção Elétrica Lar Ver mais Aviso Legal Política de Cookies Política de Privacidade Política de Privacidade Accom Livro de Reclamações Colaborador Oficial Compare as tarifas da Iberdrola e encontre a opção ideal. Faça o seu contrato Iberdrola online de forma rápida e fácil - comece a poupar hoje mesmo!
15	https://easydmarc.com/	https://www.bing.com/th?id=OADD2.7559332400635_1NJ2WY3WO9W5H1JD7P&pid=21.2	good	EasyDMARC | Your DMARC Journey Made Simple		DMARC Made Simple Analyze Your Domain’s Security Join the 175,000+ domains secured with us Simplify, Manage, and Automate Your DMARC Journey: EasyDMARC It Reliable Easy to Manage Risk-Free Fast Key Features for Enhanced Security and Deliverability Managed Services EasySPF Reputation Monitoring Managed DKIM DMARC Compliance Made Easy Here are some of the regulations that mandate DMARC compliance as best practice in email security: EasyDMARC Blog. Enrich Your Email Security Knowledge Understanding and Analyzing DMARC Reports How to fix “no DMARC record found” Understanding Gmail and Yahoo Error Codes New Feature: Managed MTA-STS and TLS Reporting DMARC is Becoming Mandatory for PCI DSS Compliance EasySender: EasyDMARC’s New Email Deliverability Platform WE’RE FEATURED IN Guard Against Financial, Data, and Customer Loss WE BLOCK 380K+ WE AUTHENTICATE 9B+ WE ANALYZE 27M+ WE SEND 180K+ WE CHECK 15K+ WE MONITOR 14K+ 175,000+ domains from 130 countries Global presence Great companies meet and beat compliance with EasyDMARC Heather Diaz Explore the Beneficial Partnership of fTLD and EasyDMARC! Start Your DMARC Journey With Our Free Courses Make Your DMARC Journey Simple With EasyDMARC	easydmarc your dmarc journey made simple			REGULATION WHAT IT MEANS REGION INDUSTRY; Microsoft sender requirements: Requirement to set up SPF, DKIM, and DMARC for sending domains: Global requirement from 5 May 2025: All co	Your smart DMARC reporting and monitoring platform. Ensure domain-level security and email deliverability with EasyDMARC’s DMARC, SPF, DKIM, and BIMI services.	Back to Top Catch Us at the Official Cybersecurity Summit | Tampa, 2026 – Live Demos, Expert Tips & More! Contact Us Get Support Sign In Products Tools Pricing Resources Industries MSPs & Resellers Start Free Trial Get A Demo Your one-stop solution for all things DMARC. Solve email security and deliverability issues in just a few clicks. Scan Domain Please provide a valid domain Recognized as a Leader by Experts Protect your company reputation, ensure compliance with industry regulations, and boost email deliverability with our DMARC platform. Trusted by over 175,000 domains, we deliver robust, scalable solutions that grow with your organization’s needs, ensuring long-term security and stability. Our smart dashboards and simplified reporting keep your email authentication on track, reducing time spent troubleshooting and increasing operational efficiency. We provide peace of mind with world-class support, available 24/7, so you can focus on your business while we handle your email security. Our streamlined DMARC implementation ensures a rapid, hassle-free transition from monitoring to full enforcement, minimizing disruptions and enhancing email deliverability. Request Demo Reduce cyberattack risks, solve deliverability issues, and manage your domain quickly and reliably with our easy-to-use platform. Our white-glove solution provides a safe and comprehensive setup and management of DMARC, SPF, and DKIM. From configuration to enforcement, our experts ensure your email authentication is accurate, secure, and aligned with best practices. A dedicated DMARC Engineer supports you every step of the way. Find Out More DMARC is mandatory in many industries globally, as protecting company data and consumer privacy becomes increasingly important. Your business needs to become compliant with regulations quickly, accurately, and without risk, and EasyDMARC makes compliance seamless. REGULATION WHAT IT MEANS REGION INDUSTRY Microsoft sender requirements Requirement to set up SPF, DKIM, and DMARC for sending domains Global requirement from 5 May 2025 All companies sending over 5,000 emails daily that include hotmail.com, live.com, and outlook.com consumer domain addresses Google & Yahoo sender requirements Global requirement from February 2024 All companies sending over 5,000 emails daily that include Google or Yahoo addresses General Data Protection Regulation (GDPR) Europe’s primary data privacy and security law EU countries All industries Digital Operational Resilience Act (DORA) Framework to manage ICT cybersecurity risks EU countries from January 2025 Financial institutions (insurers, banks, lenders, financial and investment advisors) Network and Information Security Directive (NIS 2) Revised EU Directive on ICT cybersecurity risks EU countries from October 2024 Multiple sectors, including telecoms, ICT, health, energy, chemicals, and manufacturing Payment Card Industry Data Security Standard (PCI DSS 4.0) Technical and operational requirements to protect payment data Global requirement from March 2025 All companies processing, storing, or transmitting payment card data California Consumer Privacy Act (CPPA) Provides privacy rights and consumer protection All companies targeting people in California, US The Gramm-Leach-Bliley Act (GLBA) Safeguards consumers' financial information and requires transparency in how it's shared The Health Insurance Portability and Accountability Act (HIPAA) Establishes standards to protect personal health information Healthcare industry Get the email security content, DMARC, SPF, DKIM, and BIMI technical knowledge, and cybersecurity-related articles from our DMARC engineers. Find out more Use EasyDMARC to prevent cybercriminals from sending fraudulent emails to your business partners, employees, and customers from your business email addresses. DOMAIN SPOOFING ATTEMPTS PER DAY EMAILS DATA POINTS DMARC REPORTS PER WEEK PHISHING URLS DOMAINS 4 Offices US, UK, Netherlands & Armenia Discover shared thoughts and learn more about businesses growing safely with EasyDMARC. Vice President of Compliance and Policy at fTLD “Any business that isn’t yet using a provider in the email authentication space should surely look into working with EasyDMARC for peace of mind, security, and maturing their email security program.” View Case Study EasyDMARC Academy is a free, self-paced learning platform built to make email authentication easier to understand for everyone, from beginners to IT professionals. Our courses break down complex topics like SPF, DKIM, and DMARC into clear, practical lessons that help you protect your domain from phishing, spoofing, and other email-based threats. Whether you're just starting out in cybersecurity or are an experienced IT specialist, the Academy offers free, accessible certification programs designed to boost your expertise. As you complete each course, you'll earn recognized certifications that enhance your professional credibility and open up new career opportunities. Enroll Now Contact Us All Tools DMARC Checker SPF Checker DKIM Checker DMARC Generator SPF Record Generator Domain Scanner DKIM Generator BIMI Checker DNS Record Lookup Phishing Link Checker DMARC Report Analyzer IP Reputation Check Platform DMARC XML Report Analyzer Aggregate GeoMaps DMARC Failure Reports Email Header Analyzer Reputation Monitoring Managed DMARC Managed BIMI Email Verification Solutions ISP and Telecoms Startups Small/Midsize Business Enterprise Marketing Insurance Finance NonProfit Healthcare Education Government Retail Information Security Partnerships MSP/MSSP Referral Program Blog Library Knowledge Base News Company About EasyDMARC Careers Other Bug Bounty Program Status Page Contact us Get Support Legal and Compliance Security Policy Trust Center © EasyDMARC Inc. 2026 | All Rights Reserved Your smart DMARC reporting and monitoring platform. Ensure domain-level security and email deliverability with EasyDMARC’s DMARC, SPF, DKIM, and BIMI services.
